{
  "notice-1": {
    "notice_date": "March 20th 2025",
    "publication_name": "The Californian",
    "location_name": "CubeSmart Management LLC",
    "street_address": "7600 Arlington Ave",
    "city": "Riverside",
    "state": "CA",
    "zip_code": "92503",
    "auction_site_used": "www.storagetreasures.com",
    "count_of_tenants": 15,
    "all_tenants": [
      "Gloria Raquel Alvarez",
      "Avila Andrea Renee Colbert",
      "Brandon Samuel",
      "Stacey Jennings",
      "Byron May",
      "Gretta Urista",
      "Alonzo Scott",
      "brandon Roberts",
      "Blake Jackson",
      "Ricardo Alvarado",
      "Sergio G Cuevas",
      "Christopher Bell",
      "Manuel Niebla",
      "Keionna L Winbush",
      "Charles Isaac Clayton",
      "Cindy Kovacs",
      "John Marti duke",
      "alloh Tonia Gallagher",
      "Karma Backrak"
    ],
    "full_notice_text": "NOTICE OF PUBLIC SALE: Self-storage cube contents of the following customers containing household and other goods will be sold for cash by CubeSmart Management LLC 7600 Arlington Ave Riverside CA 92503 to satisfy a lien on March 20th 2025 at approx 1:30pm at www storagetreasures com [http://www storagetreasures com]: Gloria Raquel Alvarez Avila Andrea Renee Colbert Brandon Samuel Stacey Jennings Byron May Gretta Urista Alonzo Scott brandon Roberts Blake Jackson Ricardo Alvarado Sergio G Cuevas Christopher Bell Manuel Niebla Keionna L Winbush Charles Isaac Clayton Cindy Kovacs John Marti duke alloh Tonia Gallagher Karma Backrak The CalifornianPublished: 2/28/25"
  },
  "notice-2": {
    "notice_date": "March 20th 2025",
    "publication_name": "The Californian",
    "location_name": "CubeSmart Management LLC",
    "street_address": "7600 Arlington Ave",
    "city": "Riverside",
    "state": "CA",
    "zip_code": "92503",
    "auction_site_used": "www.storagetreasures.com",
    "count_of_tenants": 15,
    "all_tenants": [
      "Gloria Raquel Alvarez",
      "Avila Andrea Renee Colbert",
      "Brandon Samuel",
      "Stacey Jennings",
      "Byron May",
      "Gretta Urista",
      "Alonzo Scott",
      "brandon Roberts",
      "Blake Jackson",
      "Ricardo Alvarado",
      "Sergio G Cuevas",
      "Christopher Bell",
      "Manuel Niebla",
      "Keionna L Winbush",
      "Charles Isaac Clayton",
      "Cindy Kovacs",
      "John Marti duke",
      "alloh Tonia Gallagher",
      "Karma Backrak"
    ],
    "full_notice_text": "NOTICE OF PUBLIC SALE: Self-storage cube contents of the following customers containing household and other goods will be sold for cash by CubeSmart Management LLC 7600 Arlington Ave Riverside CA 92503 to satisfy a lien on March 20th 2025 at approx 1:30pm at www storagetreasures com [http://www storagetreasures com]: Gloria Raquel Alvarez Avila Andrea Renee Colbert Brandon Samuel Stacey Jennings Byron May Gretta Urista Alonzo Scott brandon Roberts Blake Jackson Ricardo Alvarado Sergio G Cuevas Christopher Bell Manuel Niebla Keionna L Winbush Charles Isaac Clayton Cindy Kovacs John Marti duke alloh Tonia Gallagher Karma Backrak The CalifornianPublished: 2/28/25"
  },
  "notice-3": {
    "notice_date": "March 20th 2025",
    "publication_name": "The Californian",
    "location_name": "CubeSmart Management LLC",
    "street_address": "4011 Fairgrounds St",
    "city": "Riverside",
    "state": "CA",
    "zip_code": "92501",
    "auction_site_used": "www.storagetreasures.com",
    "count_of_tenants": 30,
    "all_tenants": [
      "Stephanie Simpson",
      "Anthony Montoya",
      "Roman Saenz",
      "Jeremy Ortega",
      "Kim Ngoc",
      "Kaliyanei Nguyen",
      "Shaw Ryan Kelly",
      "Vanessa Linares",
      "Denise Dufrene",
      "Tomas Esparza",
      "Alida Turner-Adepoju",
      "Justin Gregory",
      "Justin Fawcett",
      "Cesar Andres Tapia",
      "Kimberly Basel",
      "Troy Basil",
      "Tiffany Limon",
      "Triva Frazier",
      "David Andrew Washington",
      "Peter Davis",
      "Fena D Butts",
      "Jamil Horton",
      "Rita Gildon",
      "Colin Fleming",
      "Yazmin Anguiano",
      "Marie Reinalda",
      "Tarika Marie Benford",
      "Reyne Marcella Gonzales",
      "Rocio Hernandez",
      "Abel Vasquez",
      "Vanessa Arredondo",
      "cheri Hernandez",
      "Jinwook Choi",
      "Mariah Sanchez",
      "Indira Sanchez",
      "Eugene Houston Iii",
      "Sims Jennifer Donez",
      "Charles Ervin",
      "Christina Fonstein",
      "Michael Mossberg",
      "Roman Verdugo",
      "CHYLYKA JUSTICE",
      "Andrew Sanchez"
    ],
    "full_notice_text": "NOTICE OF PUBLIC SALE: Self-storage Cube contents of the following customers containing household and other goods will be sold for cash by CubeSmart Management LLC 4011 Fairgrounds St Riverside CA 92501 to satisfy a lien on March 20th 2025 at approx 1:30 PM at www storagetreasures com: Stephanie Simpson Anthony Montoya Roman Saenz Jeremy Ortega Kim Ngoc Kaliyanei Nguyen Shaw Ryan Kelly Vanessa Linares Denise Dufrene Tomas Esparza Alida Turner-Adepoju Justin Gregory Justin Fawcett Cesar Andres Tapia Kimberly Basel Troy Basil Tiffany Limon Triva Frazier David Andrew Washington Peter Davis Fena D Butts Jamil Horton Rita Gildon Colin Fleming Yazmin Anguiano Marie Reinalda Tarika Marie Benford Reyne Marcella Gonzales Rocio Hernandez Abel Vasquez Vanessa Arredondo cheri Hernandez Jinwook Choi Mariah Sanchez Indira Sanchez Eugene Houston Iii Sims Jennifer Donez Charles Ervin Christina Fonstein Michael Mossberg Roman Verdugo CHYLYKA JUSTICE Andrew Sanchez The CalifornianPublished: 2/28 3/7/25"
  },
  "notice-4": {
    "notice_date": "March 11 2025",
    "publication_name": "Brentwood Press",
    "location_name": "Bethel Island Estates MHC",
    "street_address": "4400 Gateway Road Space 39",
    "city": "Bethel Island",
    "state": "California",
    "zip_code": "94511",
    "auction_site_used": "Bethel Island Estates MHC",
    "count_of_tenants": 4,
    "all_tenants": [
      "Marvin K Herron",
      "Marge Herron",
      "Ronald A Doolittle",
      "Lynnette DR Jackson"
    ],
    "full_notice_text": "PUBLIC NOTICE NOTICE OF WAREHOUSE LIEN SALE NOTICE IS HEREBY GIVEN that in accordance with California Commercial Code Sections 7209 and 7210 and California Civil Code Section 798 56a the mobilehome described as a 1967 FLEETWOOD Decal No ABJ4054 Serial No YK7M1S0526 located at 4400 Gateway Road Space 39 Bethel Island California 94511 will be sold at public auction at 9:00 a m on March 11 2025 at Bethel Island Estates MHC 4400 Gateway Road Space 39 Bethel Island California 94511 The parties believed to claim an interest Marvin K Herron Marge Herron Ronald A Doolittle Lynnette DR Jackson have been given notice and the time specified for payment has expired The undersigned is entitled to a warehouse lien against said mobilehome to satisfy the lien and other related charges incurred including reasonable charges of notice advertisement and sale Marvin K Herron Marge Herron Ronald A Doolittle Lynnette DR Jackson Registered Owners Legal Owners interested Parties please take further notice that in order to prevent the mobilehome from being sold at the noticed sale the following amount must be paid prior to the sale Total claim to date of $6985 99 (additional amounts incurred shall be added to this amount as provided in the Commercial Code) Bidders are required to show proof of cashier\u00e2\u20ac\u2122s check(s) / money order(s) in an amount equal to the claim to date amount prior to bidding to Lisa McKee 3511 Del Paso Rd Ste 160 PMB 445 Sacramento CA 95835 (916) 601-6149 Authorized Agent for Bethel Island Estates MHC LLC Brentwood Press No 02-1273 Publish Dates: February 21 28 2025"
  },
  "notice-5": {
    "notice_date": "March 20th 2025",
    "publication_name": "The Californian",
    "location_name": "CubeSmart Management LLC",
    "street_address": "3915 Green River Rd",
    "city": "Corona",
    "state": "CA",
    "zip_code": "92878",
    "auction_site_used": "www.storagetreasures.com",
    "count_of_tenants": 10,
    "all_tenants": [
      "Adina Hawthorne",
      "Antoinette Taylor",
      "David Vines",
      "Manuel Robert Garcia",
      "Annette Dickerson",
      "Leticia Morales",
      "Shameika Hamilton",
      "Kelvin Bragg",
      "Haylee Nicole Hampton",
      "Lorena Alicia Garcia",
      "Kayli Spooner",
      "Sandy Luna",
      "Kerrie Jones"
    ],
    "full_notice_text": "NOTICE OF PUBLIC SALE: Self- Cube contents of the following customers containing household and other goods will be sold for cash by CubeSmart Management LLC 3915 Green River Rd Corona CA 92878 to satisfy a lien on March 20th 2025 at approx 1:30PM at www storagetreasures com [http://www storagetreasures com]: Adina Hawthorne Antoinette Taylor David Vines Manuel Robert Garcia Annette Dickerson Leticia Morales Shameika Hamilton Kelvin Bragg Haylee Nicole Hampton Lorena Alicia Garcia Kayli Spooner Sandy Luna Kerrie Jones The CalifornianPublished: 2/28/25"
  },
  "notice-6": {
    "notice_date": "March 19 2025",
    "publication_name": "The Californian",
    "location_name": "CubeSmart Management LLC",
    "street_address": "24335 Monroe Avenue",
    "city": "Murrieta",
    "state": "CA",
    "zip_code": "92562",
    "auction_site_used": "www.storagetreasures.com",
    "count_of_tenants": 8,
    "all_tenants": [
      "Annette Gonzales",
      "Katherine Sparks",
      "Cecelia Velasco",
      "Kenneth Myers",
      "William Calvo",
      "Victoria Szwabowski",
      "Breanna Harris",
      "Jeremy Kelley"
    ],
    "full_notice_text": "NOTICE OF PUBLIC SALE: Self-storage Cube contents of the following customers containing household and other goods will be sold for cash by CubeSmart Management LLC 24335 Monroe Avenue Murrieta CA 92562 to satisfy a lien on March 19 2025 at approx 1:30 PM at www storagetreasures com [http://www storagetreasures com]: Annette Gonzales Katherine Sparks Cecelia Velasco Kenneth Myers William Calvo Victoria Szwabowski Breanna Harris Jeremy Kelley The CalifornianPublished: 2/28/25"
  },
  "notice-7": {
    "notice_date": "March 19th 2025",
    "publication_name": "The Californian",
    "location_name": "CubeSmart Management LLC",
    "street_address": "28401 Rancho California Rd",
    "city": "Temecula",
    "state": "CA",
    "zip_code": "92590",
    "auction_site_used": "www.storagetreasures.com",
    "count_of_tenants": 5,
    "all_tenants": [
      "Jonathan Burns",
      "Icenogle",
      "Mitchell Huelden",
      "Vicente Salas",
      "Tony Goodwin",
      "Pedro Luis Flores"
    ],
    "full_notice_text": "NOTICE OF PUBLIC SALE: Self-storage Cube contents of the following customers containing household and other goods will be sold for cash by CubeSmart Management LLC 28401 Rancho California Rd Temecula CA 92590 to satisfy a lien on March 19th 2025 at approx 1:30pm at www storagetreasures com : Jonathan Burns Icenogle Mitchell Huelden Vicente Salas Tony Goodwin Pedro Luis Flores The CalifornianPublished: 2/28/25"
  },
  "notice-8": {
    "notice_date": "March 19 2025",
    "publication_name": "The Californian",
    "location_name": "CubeSmart Management LLC",
    "street_address": "40410 California Oaks RD",
    "city": "Murrieta",
    "state": "CA",
    "zip_code": "92562",
    "auction_site_used": "www.storagetreasures.com",
    "count_of_tenants": 6,
    "all_tenants": [
      "Ivan Lopez",
      "Michelle Launier",
      "Donovan Lucas",
      "Rose Goodman",
      "Syrita Kinney",
      "Timothy Kiehl"
    ],
    "full_notice_text": "NOTICE OF PUBLIC SALE: Self- Cube contents of the following customers containing household and other goods will be sold for cash by CubeSmart Management LLC 40410 California Oaks RD Murrieta CA 92562 to satisfy a lien on March 19 2025 at approximately 1:30PM at www storagetreasures com [http://www storagetreasures com]"
  },
  "notice-9": {
    "notice_date": "March 19th 2025",
    "publication_name": "The Californian",
    "location_name": "CubeSmart Management LLC",
    "street_address": "44618 Pechanga Parkway",
    "city": "Temecula",
    "state": "CA",
    "zip_code": "92592",
    "auction_site_used": "www.storagetreasures.com",
    "count_of_tenants": 8,
    "all_tenants": [
      "Carla Derobertis",
      "Brandee Ybarra",
      "Adena Marlene Willis",
      "Jesse Paul",
      "Annie Page",
      "Elia Duran",
      "Seth Visocky"
    ],
    "full_notice_text": "NOTICE OF PUBLIC SALE: Self storage Cube contents of the following customers containing household and other goods will be sold for cash by CubeSmart Management LLC 44618 Pechanga Parkway Temecula CA 92592 to satisfy a lien on March 19th 2025 at approx 1:30pm at www storagetreasures com: Carla Derobertis Brandee Ybarra Adena Marlene Willis Jesse Paul Annie Page Elia Duran Seth Visocky The CalifornianPublished: 2/28/25"
  },
  "notice-10": {
    "notice_date": "March 20 2025",
    "publication_name": "Redlands Daily Facts",
    "location_name": "CubeSmart Management LLC",
    "street_address": "1680 W Redlands Blvd",
    "city": "Redlands",
    "state": "CA",
    "zip_code": "92373",
    "auction_site_used": "www.storagetreasures.com",
    "count_of_tenants": 6,
    "all_tenants": [
      "Christina Audelo",
      "Phillip P Conarroe",
      "Penelope Allen",
      "Brianna Blair",
      "Mya Roberts",
      "Robert L Hoffmaster"
    ],
    "full_notice_text": "NOTICE OF PUBLIC SALE: Self- Cube contents of the following customers containing household and other goods will be sold for cash by CubeSmart Management LLC 1680 W Redlands Blvd Redlands CA 92373 to satisfy a lien on March 20 2025 at approx 1:30 PM at www storagetreasures com: Christina Audelo Phillip P Conarroe Penelope Allen Brianna Blair Mya Roberts Robert L Hoffmaster Redlands Daily FactsPublished: 2/28/25"
  },
  "notice-11": {
    "notice_date": "March 20 2025",
    "publication_name": "The Press-Enterprise",
    "location_name": "CubeSmart Asset Management LLC",
    "street_address": "4250 W Florida Ave",
    "city": "Hemet",
    "state": "CA",
    "zip_code": "92545",
    "auction_site_used": "www.storagetreasures.com",
    "count_of_tenants": 10,
    "all_tenants": [
      "Christina Lozano",
      "Bridget Shockley",
      "David Gilliam",
      "Gloria Kahrs",
      "Francisco Rodriguez",
      "Tracy Franklin",
      "Read Tiera Lomas",
      "Phyllis Davis",
      "(2) Anthony Skelhorn"
    ],
    "full_notice_text": "NOTICE OF PUBLIC SALE: Self- Cube contents of the following customers containing household and other goods will be sold for cash by CubeSmart Asset Management LLC as Agent for Owner 4250 W Florida Ave Hemet CA 92545 to satisfy a lien on March 20 2025 at approx 1:30 PM at www storagetreasures com: Christina Lozano Bridget Shockley David Gilliam Gloria Kahrs Francisco Rodriguez Tracy Franklin Read Tiera Lomas Phyllis Davis (2) Anthony Skelhorn The Press-EnterprisePublished: 2/28/25"
  },
  "notice-12": {
    "notice_date": "3/19/25",
    "publication_name": "Whittier Daily News",
    "location_name": "SmartStop Self",
    "street_address": "10231 Colima Rd",
    "city": "Whittier",
    "state": "CA",
    "zip_code": "90603",
    "auction_site_used": "www.selfstorageauction.com",
    "count_of_tenants": 2,
    "all_tenants": [
      "Jennifer Holguin",
      "Manuel Cesar Monterroso Corado"
    ],
    "full_notice_text": "NOTICE OF PUBLIC SALE OF PERSONAL PROPERTY Please take notice SmartStop Self located at site 10231 Colima Rd Whittier CA 90603 intends to hold an auction of the goods stored in the following units to satisfy the lien of the owner The sale will occur as an online auction via www selfstorageauction com on 3/19/25 at 1pm or after Contents include personal property described below belonging to those individuals listed below I034 Jennifer Holguin Household Items Boxes Misc Items L001B Manuel Cesar Monterroso Corado Household Items Boxes Misc Items Purchase must be paid at the above referenced facility in order to complete the transaction SmartStop Self may refuse any bid and may rescind any purchase up until the winning bidder takes possession of the personal property Please contact the property with any questions (562) 252-1746 Whittier Daily NewsPublished: 2/28/25"
  },
  "notice-13": {
    "notice_date": "3/20/2025",
    "publication_name": "US Centers - Alameda Point Storage",
    "location_name": "Alameda Point Storage",
    "street_address": "50 W Oriskany Ave",
    "city": "Alameda",
    "state": "CA",
    "zip_code": "94501",
    "auction_site_used": "www.storagetreasures.com",
    "count_of_tenants": 3,
    "all_tenants": [
      "Richard Hunter",
      "Louis Scott",
      "Bornmann",
      "Darlene Elasigue"
    ],
    "full_notice_text": "Notice of Self Storage Sale Please take notice US Centers - Alameda Point Storage 50 W Oriskany Ave Alameda CA 94501 intends to hold a public sale to the highest bidder of the property stored by the following tenants at the storage facility The sale will occur as an online auction via www storagetreasures com on 3/20/2025 at 10:00 AM Richard Hunter (3 units) Louis Scott Bornmann Darlene Elasigue This sale may be withdrawn at any time without notice Certain terms and conditions apply AJ# 0006880375 Feb 28 2025"
  },
  "notice-14": {
    "notice_date": "2025-03-10",
    "publication_name": "Inland Valley Daily Bulletin",
    "location_name": "City Hall",
    "street_address": "5111 Benito Street",
    "city": "Montclair",
    "state": "CA",
    "zip_code": "91763",
    "auction_site_used": "",
    "count_of_tenants": 0,
    "all_tenants": [],
    "full_notice_text": "CITY OF MONTCLAIR NOTICE OF PUBLIC HEARING NOTICE IS HEREBY GIVEN that on Monday March 10 2025 at 7:00 p m in the City Council Chambers of City Hall 5111 Benito Street Montclair CA 91763 the Planning Commission of the City of Montclair will conduct a public hearing concerning Case No 2024-59 pertaining to the following: PROJECT LOCATION: 4 4-acre portion of the Costco Wholesale development at 9404 Central Avenue (a portion of Assessor Parcel Numbers:1008-361-16-0000) APPLICANT: Costco Wholesale Corporation c/o Alberto Esquivel Senior Planner Barghausen PROJECT DESCRIPTION: Costco Wholesale is seeking to relocate on-site and expand its existing fuel facility on a 4 4-acre portion of the Costco Wholesale development at 9404 Central Avenue The Project Site includes the existing fuel facility the northernmost parking areas along the west and east property boundary and two direct driveway access points The Costco warehouse building and the existing fuel facility combined encompass 14 acres and were approved under Conditional Use Permit and Precise Plan of Design No 2000-14 and Environmental Impact Report No 2000031036 The originally approved fuel facility was expanded under Conditional Use Permit No 2004-37 The Applicant is requesting a Conditional Use Permit Amendment and a Precise Plan of Design to allow the construction and operation of sixteen multi-product dispensers (MPDs) (32 fueling positions) with a 12 684 square-foot canopy three (3) 40 000-gallon gasoline underground storage tanks (USTs) one (1) 1 500-gallon additive UST and associated site improvements such as landscaping and parking lot striping Once the new facility is operational the existing fuel facility would be decommissioned and demolished and the remaining site improvements including landscape site lighting parking and directional striping would be completed The project primarily aims to improve fueling operations and reduce vehicle queueing at the existing facility ZONING: Commerce - Mixed Use per the Montclair Corridors Code GENERAL PLAN: Commerce ENVIRONMENTAL ASSESSMENT: The Planning Division has determined this project is Categorically Exempt pursuant to Class 32 The Class 32 \" Infill' Categorical Exemption (CEQA Guidelines Section 15332) hereafter referred to as the Class 32 Exemption\" exempts infill development within urbanized areas if it meets certain criteria The class consists of infill projects that are consistent with the General Plan and zoning requirements This class is not intended for projects that would result in any significant traffic noise air quality or water quality impacts A Class 32 Exemption applies to the subject project characterized as in-fill development because the project meets all the conditions described below: (a) The project is consistent with the applicable general plan designation and all applicable general plan policies as well as with applicable zoning designation and regulations (b) The proposed development occurs within city limits on a project site of no more than five acres substantially surrounded by urban uses (c) The project site has no value as habitat for endangered rare or threatened species (d) Approval of the project would not result in any significant effects relating to traffic noise air quality or water quality (e) The site can be adequately served by all required utilities and public services Further none of the exceptions outlined in CEQA Guidelines Section 15300 2 apply here INVITATION TO BE HEARD: All interested persons will be given an opportunity to comment on the above-referenced item at the public hearing and any subsequent public hearings conducted related to the item In addition written comments on the project may be submitted to the Planning Commission prior to the hearing via e-mail or U S Mail All written comments must be received by the City at least one hour before the scheduled hearing and may be e-mailed to pcclerk@cityofmontclair org or mailed to City of Montclair Attn: Planning Commission Clerk P O Box 2308 Montclair CA 91763 Please reference the hearing title and date of hearing in any correspondence Pursuant to GC 65009(b)(2) legal challenges to the City's action on this project may be limited to only those issues raised in testimony and written comments during the public hearing process Full documentation related to the above-referenced item may be reviewed at least 72 hours before the hearing by requesting to be emailed a digital copy of the documents or by downloading the agenda packet for the March 10 2025 Planning Commission meeting posted on the City\u00e2\u20ac\u2122s website at: https://www cityofmontclair org/planning-commission-meetings/ For further information concerning this project please contact Senior Planner Silvia Guti\u00c3\u00a9rrez the project coordinator at (909) 625-9435 / sgutierrez@cityofmontclair org Si desea informaci\u00c3\u00b3n en espa\u00c3\u00b1ol acerca de esta propuesta por favor comun\u00c3\u00adquese con Silvia Guti\u00c3\u00a9rrez en la ciudad de Montclair al tel\u00c3\u00a9fono (909) 625-9435 The City of Montclair does not discriminate against persons with disabilities If you need special assistance to participate in this meeting contact the project coordinator Notification prior to the meeting will enable the City to make reasonable arrangements to ensure accessibility to this meeting (28 CFR 35 102\u00e2\u20ac\u201c35 104 ADA Title II) Publish: Friday February 28 2025 Inland Valley Daily Bulletin - SBPublished: 2/28/25"
  },
  "notice-15": {
    "notice_date": "2024-07-12",
    "publication_name": "Daily Bulletin - SB",
    "location_name": "Fast & EZ Self Storage",
    "street_address": "5445 Olive Street",
    "city": "Montclair",
    "state": "CA",
    "zip_code": "91763",
    "auction_site_used": "https://www.storagetreasures.com",
    "count_of_tenants": 4,
    "all_tenants": [
      "Jesus Rosales Guiterrez",
      "Armando Simmons",
      "Delilah Macy",
      "Sunnydade Taylor"
    ],
    "full_notice_text": "Notice of Sale of Abandoned Personal and/or Business Property Fast & EZ Self Storage wishing to avail themselves of the provisions of applicable laws of the State of California Here by gives Notice of Sale under said law to with: Section 21700 through 21715 of the Business and Professions Code Section 2328 of Commercial Code Section 535 of the Penal Code on or after July 12th 2024 at 9:00 a m Fast & EZ Self Storage located at 5445 Olive Street Montclair CA 91763 will conduct and online auction on https://www.storagetreasures.com the contents of # (see below) Rented by (see below) consisting of household goods and/or business property and personal property contained in the following unit(s): #111 Jesus Rosales Guiterrez #123 Armando Simmons #221 Delilah Macy #313 Sunnydade Taylor This sale is subject to cancellation without notice in the event of settlement between owner and obligated party OWNER RESERVES THE RIGHT TO BID AND TO REFUSE OR REJECT ANY AND ALL BIDS THE SALE IS BEING MADE TO SATISFY AN OWNERS LIEN Daily Bulletin - SB Published: 2/21 2/28 Inland Valley Daily Bulletin - SBPublished: 2/21 2/28/25"
  },
  "notice-16": {
    "notice_date": "3/11/2025",
    "publication_name": "Inland Valley Daily Bulletin",
    "location_name": "Drydock Depot RV & Boat Storage",
    "street_address": "1450 N Campus Ave",
    "city": "Upland",
    "state": "CA",
    "zip_code": "",
    "auction_site_used": "",
    "count_of_tenants": 0,
    "all_tenants": [],
    "full_notice_text": "NOTICE OF LIEN SALE We Drydock Depot RV & Boat Storage has a 1994 Rein CF#\u00e2\u20ac\u2122s 2199NL CA Hull#\u00e2\u20ac\u2122s: RNA70101G394 1993 VM LC#\u00e2\u20ac\u2122s 4CX2003 CA Vin#\u00e2\u20ac\u2122s: 1VMBG1810P1001232 Which will be sold on 3/11/2025 at 10:00Am At 1450 N Campus Ave Upland CA Inland Valley Daily Bulletin - SBPublished: 2/28/25"
  },
  "notice-17": {
    "notice_date": "March 19th 2025",
    "publication_name": "San Diego Union-Tribune",
    "location_name": "CubeSmart Management LLC",
    "street_address": "2220 Watson Way",
    "city": "Vista",
    "state": "CA",
    "zip_code": "92083",
    "auction_site_used": "www.storagetreasures.com",
    "count_of_tenants": 5,
    "all_tenants": [
      "David Schwartz",
      "James William Cullen",
      "Concepcion Iniguez",
      "Guadalupe Cruz"
    ],
    "full_notice_text": "NOTICE OF PUBLIC SALE: Self-storage Cube contents of the following customers containing household and other goods will be sold for cash by CubeSmart Management LLC 2220 Watson Way Vista CA 92083 to satisfy a lien on March 19th 2025 at approx 1:30 PM at www storagetreasures com: David Schwartz James William Cullen Concepcion Iniguez Guadalupe Cruz San Diego Union-TribunePublished: 2/28/25"
  },
  "notice-18": {
    "notice_date": "2/28/25",
    "publication_name": "San Diego Union-Tribune",
    "location_name": "U-Haul moving and storage of Miramar",
    "street_address": "9650 Camino Ruiz",
    "city": "San Diego",
    "state": "CA",
    "zip_code": "92126",
    "auction_site_used": "jmichaelsauctions com",
    "count_of_tenants": 4,
    "all_tenants": [
      "Jeanne Koepsel Caplan #2494-97",
      "Kathleen Urbiztondo #2511",
      "Cleveland Combs #2366",
      "Marvin Madariaga #1009"
    ],
    "full_notice_text": "Notice is hereby given that U-Haul Company of Oceanside auction will take place online Monday March 17th at 12:00pm at jmichaelsauctions com at U-Haul moving and storage of Miramar 9650 Camino Ruiz San Diego CA 92126 Items sold are generally described as: clothing furniture and/or household items belonging to the following: Jeanne Koepsel Caplan #2494-97 Kathleen Urbiztondo #2511 #1033 Cleveland Combs #2366 Marvin Madariaga #1009 Notice is hereby given that U-Haul Company of Oceanside auction will take place online Monday March 17th at 12:00pm at jmichaelsauctions com at U-Haul moving and storage of Oceanside 802 S Coast Hwy Oceanside CA 92054 Items sold are generally described as: clothing furniture and/or household items belonging to the following: Kristin Vitek #1053 Guadalupe Sanchez #1111"
  },
  "notice-19": {
    "notice_date": "March 19 2025",
    "publication_name": "San Diego Union-Tribune",
    "location_name": "CubeSmart Management LLC",
    "street_address": "1625 W Vista Way",
    "city": "Vista",
    "state": "CA",
    "zip_code": "92083",
    "auction_site_used": "www.storagetreasures.com",
    "count_of_tenants": 10,
    "all_tenants": [
      "Matthew Camara",
      "Patrick J Oates",
      "DAVID HART",
      "Devin Woodfork",
      "Andre Dolengewicz",
      "Floriberto Garcia",
      "Kirk T Camblin",
      "Jonathan Westfall",
      "Joshua Simmons",
      "Shannon Snelling",
      "Ignacio Villarreal",
      "Toby Underwood",
      "Haley Alvarez",
      "Hector Mendez-Mayo",
      "Juan Payan"
    ],
    "full_notice_text": "NOTICE OF PUBLIC SALE: Self-storage Cube contents of the following customers containing household and other goods will be sold for cash by CubeSmart Management LLC 1625 W Vista Way Vista CA 92083 to satisfy a lien on March 19 2025 at approx 1:30pm at www storagetreasures com: Matthew Camara Patrick J Oates DAVID HART Devin Woodfork Andre Dolengewicz Floriberto Garcia Kirk T Camblin Jonathan Westfall Joshua Simmons Shannon Snelling Ignacio Villarreal Toby Underwood Haley Alvarez Hector Mendez-Mayo Juan Payan San Diego Union-TribunePublished: 2/28/25"
  },
  "notice-20": {
    "notice_date": "March 19 2025",
    "publication_name": "San Diego Union-Tribune",
    "location_name": "CubeSmart Management LLC",
    "street_address": "201 Via El Centro",
    "city": "Oceanside",
    "state": "CA",
    "zip_code": "92058",
    "auction_site_used": "www.storagetreasures.com",
    "count_of_tenants": 12,
    "all_tenants": [
      "Vicken Topdjian",
      "Char Smith",
      "Kenneth Ahrens",
      "Angel Lujan",
      "Angel Lujan",
      "Manuel Betancourt",
      "Luis Marron",
      "Kaitlyn Duoblys",
      "Bianca Nares",
      "Chasity Young",
      "Anthony Hernandez",
      "James Pannell",
      "Derrick Smith",
      "Zoey Watkins",
      "Madison Daniels",
      "Josephine Convocar",
      "Hannah Wilson",
      "Ruben Vidaca",
      "Kaari Bakari",
      "Shanelle Avery",
      "Rebecca May"
    ],
    "full_notice_text": "NOTICE OF PUBLIC SALE: Self-storage Cube contents of the following customers containing household and other goods will be sold for cash by CubeSmart Management LLC 201 Via El Centro Oceanside CA 92058 to satisfy a lien on March 19 2025 at approx 1:30 PM at www storagetreasures com: Vicken Topdjian Char Smith Kenneth Ahrens Angel Lujan Angel Lujan Manuel Betancourt Luis Marron Kaitlyn Duoblys Bianca Nares Chasity Young Anthony Hernandez James Pannell Derrick Smith Zoey Watkins Madison Daniels Josephine Convocar Hannah Wilson Ruben Vidaca Kaari Bakari Shanelle Avery Rebecca May San Diego Union-TribunePublished: 2/28/25"
  },
  "notice-21": {
    "notice_date": "February 28, 2025",
    "publication_name": "SIERRA SUN",
    "location_name": "Grass Valley Self Storage",
    "street_address": "946 Golden Gate Terrace",
    "city": "Grass Valley",
    "state": "CA",
    "zip_code": "95945",
    "auction_site_used": "www.selfstorageauction.com",
    "count_of_tenants": 3,
    "all_tenants": [
      "Jennifer Webb",
      "Monte Mitchell",
      "Alexandra Craelli"
    ],
    "full_notice_text": "Lien Sale Auction Advertisement Notice is hereby given that Pursuant to the California Self-Service Facility Act (B&P Code 21700 et seq ) Auction to be held at 11 am On March 13th 2024 at www selfstorageauction com The property is stored at: Grass Valley Self Storage 946 Golden Gate Terrace Grass Valley CA 95945 NAME OF TENANT Jennifer Webb 016 Monte Mitchell 337PH Alexandra Craelli 566 2/28/25 CNS-3897787# SIERRA SUN Published: February 28 2025"
  },
  "notice-22": {
    "notice_date": "March 19 2025",
    "publication_name": "San Diego Union-Tribune",
    "location_name": "CubeSmart Management LLC",
    "street_address": "514 Ammunition Rd",
    "city": "Fallbrook",
    "state": "CA",
    "zip_code": "92028",
    "auction_site_used": "www.storagetreasures.com",
    "count_of_tenants": 5,
    "all_tenants": [
      "Kandice C Pierce",
      "Joy Loioco",
      "Yanet Zaragoza",
      "Alicia Ortiz",
      "Jaime Escobedo"
    ],
    "full_notice_text": "NOTICE OF PUBLIC SALE: Self-storage Cube contents of the following customers containing household and other goods will be sold for cash by CubeSmart Management LLC 514 Ammunition Rd Fallbrook CA 92028 to satisfy a lien on March 19 2025 at approx 1:30 PM at www storagetreasures com [http://www storagetreasures com]"
  },
  "notice-23": {
    "notice_date": "3/18/2025",
    "publication_name": "Storage Treasures",
    "location_name": "Extra Space Storage",
    "street_address": "2807 Skyway Dr",
    "city": "Santa Maria",
    "state": "CA",
    "zip_code": "93455",
    "auction_site_used": "www.storagetreasures.com",
    "count_of_tenants": 1,
    "all_tenants": [
      "Stephanie Jenkins"
    ],
    "full_notice_text": "STORAGE TREASURES AUCTION Extra Space Storage will hold a public auction to sell personal property described below belonging to those individuals listed below at the location indicated: 2807 Skyway Dr Santa Maria CA 93455 3/18/2025 at 11:00 AM Stephanie Jenkins The auction will be listed and advertised on www storagetreasures com Purchases must be made with cash only and paid at the above referenced facility in order to complete the transaction Extra Space Storage may refuse any bid and may rescind any purchase up until the winning bidder takes possession of the personal property Pub dates: Feb 28 2025 Legal ######"
  },
  "notice-24": {
    "notice_date": "February 21 28 2025",
    "publication_name": "LYRK0243776",
    "location_name": "Tarmac American EZ Storage",
    "street_address": "2909 Tarmac Rd",
    "city": "Redding",
    "state": "CA",
    "zip_code": "96003",
    "auction_site_used": "Tarmac American EZ Storage",
    "count_of_tenants": 8,
    "all_tenants": [
      "Karriona Calda E01",
      "James Manns B13",
      "Lester Reed D9",
      "Marie Armenta A37",
      "Jessica Armstrong E25",
      "Sarah Gleaton A03"
    ],
    "full_notice_text": "Tarmac American EZ Storage Auction The personal property of the following people has been abandoned left unclaimed and will be sold at auction to satisfy lien at Tarmac American EZ Storage: Karriona Calda E01 James Manns B13 Lester Reed D9 D15 182 Marie Armenta A37 Jessica Armstrong E25 Sarah Gleaton A03 Auction will be held 3/1/2025 at 9:30 am Meet at Tarmac American EZ Storage at 2909 Tarmac Rd Redding CA 96003 Auctioneer Bond #57BSBFT9190 February 21 28 2025 LYRK0243776"
  }
}